id,theme,question,reponse_1,reponse_2,reponse_3,reponse_4,bonne_reponse,explication,difficulte
453,Gastronomie,Quel pain plat indien accompagne souvent les currys ?,Le pita,Le naan,La tortilla,Le focaccia,2,Le naan est cuit contre la paroi du four tandoor.,2
454,Gastronomie,Quel plat italien de riz crémeux est remué en continu pendant la cuisson ?,Les gnocchi,Le risotto,La polenta,Les tagliatelles,2,Le risotto s'obtient en incorporant progressivement le bouillon au riz arborio ou carnaroli.,2
455,Gastronomie,Quel est l'ingrédient principal de la mayonnaise ?,Le lait,L'huile et le jaune d'œuf,La crème,Le beurre,2,"La mayonnaise est une émulsion d'huile dans le jaune d'œuf, stabilisée par la lécithine.",2
456,Gastronomie,Quel poisson est utilisé pour préparer les sushis nigiri les plus classiques ?,La sardine,Le thon ou le saumon,Le hareng,La sole,2,Thon (maguro) et saumon (sake) figurent parmi les garnitures les plus répandues.,2
457,Gastronomie,Quel produit de la mer est à la base du surimi ?,Le crabe,La chair de poisson blanc,La crevette,Le homard,2,"Le surimi est fabriqué à partir de chair de poisson blanc broyée, aromatisée au goût de crabe.",2
458,Gastronomie,Quel plat alsacien associe choucroute et charcuterie ?,Le baeckeoffe,La choucroute garnie,La flammekueche,Le kougelhopf,2,"La choucroute garnie associe chou fermenté, saucisses, lard et pommes de terre.",2
459,Gastronomie,Quel est le pays d'origine du kebab ?,La Grèce,La Turquie,Le Liban,L'Iran,2,Le döner kebab est né en Turquie ; il s'est diffusé en Europe via l'Allemagne.,2
460,Gastronomie,"Quel plat grec associe aubergines, viande hachée et béchamel ?",Le tzatziki,La moussaka,Le souvlaki,La feta,2,"La moussaka est un gratin traditionnel grec, proche du parmigiana italien.",2
461,Gastronomie,"De quel pays vient le gaspacho, soupe froide de légumes ?",L'Italie,L'Espagne,Le Portugal,La Grèce,2,"Le gaspacho andalou se boit frais, à base de tomate, concombre et poivron.",2
462,Gastronomie,"Combien de temps faut-il pour cuire un œuf à la coque, environ ?",1 minute,3 minutes,10 minutes,20 minutes,2,"Un œuf à la coque cuit environ 3 minutes dans l'eau bouillante ; le blanc prend, le jaune reste liquide.",2
463,Gastronomie,Quel ustensile sert à séparer le blanc du jaune d'œuf sans le percer ?,Le fouet,Le sépare-œuf,La spatule,L'écumoire,2,Le sépare-œuf retient le jaune tout en laissant passer le blanc.,2
464,Gastronomie,Quel produit italien est un jambon cru affiné célèbre ?,La mortadelle,Le prosciutto di Parma,La pancetta,Le salami,2,Le prosciutto di Parma est affiné au minimum douze mois.,2
465,Gastronomie,Quelle boisson mexicaine est distillée à partir de l'agave bleue ?,Le mezcal,La tequila,Le pulque,Le rhum,2,La tequila provient exclusivement de l'agave bleue de la région de Tequila.,2
466,Gastronomie,Quelle est la particularité du riz utilisé pour les sushis ?,Il est cuit à la vapeur seulement,"Il est assaisonné de vinaigre, sucre et sel",Il est frit,Il est cru,2,Le riz à sushi (shari) est assaisonné pour lui donner goût et texture collante.,2
467,Gastronomie,Quelle viande est utilisée dans la blanquette traditionnelle ?,Le bœuf,Le veau,L'agneau,Le porc,2,"La blanquette de veau est mijotée dans un bouillon crémé, sans coloration.",2
468,Gastronomie,Quel produit laitier est obtenu en barattant la crème ?,Le yaourt,Le beurre,Le fromage blanc,La crème fraîche,2,Le barattage sépare la matière grasse (beurre) du babeurre.,2
469,Gastronomie,Quelle échelle mesure la force des piments ?,L'échelle de Richter,L'échelle de Scoville,L'échelle de Mohs,L'échelle de Beaufort,2,"L'échelle de Scoville, créée en 1912, quantifie la concentration en capsaïcine.",2
470,Gastronomie,Quelle est la base de la sauce pesto génoise ?,Le persil,Le basilic,La coriandre,La menthe,2,"Le pesto associe basilic, pignons, ail, parmesan et huile d'olive.",2
471,Gastronomie,"Quel dessert oriental est fait de pâte filo, de noix et de sirop ?",Le baklava,Le loukoum,Le halva,Le kunefe,1,Le baklava est répandu de la Turquie à la Grèce et au Moyen-Orient.,2
472,Gastronomie,Quel type de cuisson consiste à plonger brièvement un aliment dans l'eau bouillante ?,Le braisage,Le blanchiment,Le pochage,Le rissolage,2,Le blanchiment fixe la couleur des légumes et facilite l'épluchage.,3
473,Gastronomie,"Quelle sauce française est à base de jaune d'œuf, de beurre clarifié et de citron ?",La béchamel,La hollandaise,La mayonnaise,La béarnaise,2,La sauce hollandaise est l'une des sauces mères de la cuisine française.,3
474,Gastronomie,Quel poisson est traditionnellement utilisé pour faire de la bouillabaisse ?,Le saumon,Les poissons de roche méditerranéens,Le cabillaud,La truite,2,"La bouillabaisse marseillaise utilise rascasse, grondin, congre et autres poissons de roche.",3
475,Gastronomie,"Quel plat coréen consiste en un bol de riz garni de légumes, viande et œuf ?",Le kimchi,Le bibimbap,Le bulgogi,Le japchae,2,"Le bibimbap se mélange avant d'être dégusté, souvent avec de la pâte de piment gochujang.",3
476,Gastronomie,Quel cépage rouge est emblématique de la Bourgogne ?,Le merlot,Le pinot noir,Le cabernet sauvignon,La syrah,2,"Le pinot noir donne les grands rouges de Bourgogne, comme le Gevrey-Chambertin.",3
477,Gastronomie,Quel cépage blanc est utilisé pour le Chablis ?,Le sauvignon,Le chardonnay,Le riesling,Le viognier,2,Le Chablis est un vin blanc de Bourgogne issu exclusivement du chardonnay.,3
478,Gastronomie,Quelle plante donne la vanille ?,Un arbre,Une orchidée,Un cactus,Une fougère,2,La vanille provient de la gousse d'une orchidée du genre Vanilla.,3
479,Gastronomie,"Quelle est la température idéale de service d'un vin rouge, en général ?",5 °C,16-18 °C,25 °C,0 °C,2,"Un rouge se sert généralement entre 16 et 18 °C, soit plus frais que la température ambiante moderne.",3
480,Gastronomie,Quel dessert français est flambé au grand Marnier avec des crêpes ?,Le baba au rhum,Les crêpes Suzette,La crêpe bretonne,Le kouign-amann,2,Les crêpes Suzette sont nappées d'une sauce à l'orange puis flambées.,3
481,Gastronomie,Quelle spécialité bretonne est un gâteau très beurré et caramélisé ?,Le far breton,Le kouign-amann,Le quatre-quarts,La galette,2,Le kouign-amann signifie 'gâteau au beurre' en breton.,3
482,Gastronomie,Quelle est la spécialité de Lyon appelée 'quenelle' ?,Un fromage,Une préparation pochée à base de farine et de poisson ou volaille,Une soupe,Un vin,2,"La quenelle lyonnaise, souvent au brochet, se sert avec une sauce Nantua.",3
483,Gastronomie,Quelle est la principale différence entre le sucre roux et le sucre blanc ?,Leur origine botanique,La présence de mélasse résiduelle,Leur calorie,Le sucre roux est artificiel,2,Le sucre roux conserve une part de mélasse qui lui donne sa couleur et son goût.,3
484,Gastronomie,Quel est le point commun entre le brie et le camembert ?,Ce sont des pâtes pressées,Ce sont des pâtes molles à croûte fleurie,Ce sont des bleus,Ce sont des chèvres,2,Tous deux sont des fromages à pâte molle recouverts d'une croûte de Penicillium.,3
485,Gastronomie,Quel fruit tropical est surnommé 'roi des fruits' en Asie du Sud-Est malgré son odeur forte ?,La mangue,Le durian,Le litchi,La papaye,2,Le durian est interdit dans de nombreux hôtels et transports en raison de son odeur puissante.,3
486,Gastronomie,Quelle bactérie transforme le lait en yaourt ?,Escherichia coli,Les ferments lactiques,La levure de bière,Le Penicillium,2,Lactobacillus bulgaricus et Streptococcus thermophilus acidifient le lait pour le faire cailler.,3
487,Gastronomie,Quel ingrédient donne son piquant au piment ?,La pipérine,La capsaïcine,L'allicine,La sinigrine,2,La capsaïcine active les récepteurs de la chaleur ; son intensité se mesure en unités Scoville.,3
488,Gastronomie,Quel plat suisse-allemand est une galette de pommes de terre râpées ?,Le rösti,Le gratin,La galette,La tortilla,1,Le rösti est une spécialité alémanique servie souvent au petit-déjeuner ou en accompagnement.,3
489,Gastronomie,Quel type de thé est le plus oxydé ?,Le thé vert,Le thé noir,Le thé blanc,Le thé oolong,2,"Le thé noir subit une oxydation complète, contrairement au thé vert.",3
490,Gastronomie,Quel repas gastronomique est également inscrit au patrimoine immatériel de l'UNESCO depuis 2010 ?,Le repas gastronomique des Français,Le brunch américain,Le tapas espagnol,Le smorgasbord suédois,1,Le repas gastronomique des Français a été le premier à obtenir cette reconnaissance.,3
491,Gastronomie,Quel est le principe de la cuisson sous vide à basse température ?,Une cuisson très rapide,Une cuisson longue à température contrôlée dans un sachet,Une friture,Une cuisson au four sec,2,"Le sous-vide permet une cuisson homogène et précise, popularisée par la gastronomie moderne.",3
492,Gastronomie,Quel chef français a été surnommé le 'pape de la gastronomie' et a marqué Lyon ?,Alain Ducasse,Paul Bocuse,Auguste Escoffier,Pierre Hermé,2,Paul Bocuse a conservé trois étoiles pendant plus de cinquante ans.,3
493,Gastronomie,Quel chef français est le plus étoilé de l'histoire du Guide Michelin ?,Paul Bocuse,Alain Ducasse,Joël Robuchon,Pierre Gagnaire,3,Joël Robuchon a cumulé plus de trente étoiles à travers ses restaurants dans le monde.,4
494,Gastronomie,Quelle réaction chimique donne la croûte dorée du pain et le goût de la viande grillée ?,La caramélisation seule,La réaction de Maillard,La fermentation,L'oxydation,2,"La réaction de Maillard, entre sucres et acides aminés, développe arômes et couleur.",4
495,Gastronomie,Quelle levure est utilisée pour la fabrication du pain et de la bière ?,Lactobacillus,Saccharomyces cerevisiae,Penicillium,Aspergillus,2,Saccharomyces cerevisiae transforme les sucres en alcool et en CO2.,4
496,Gastronomie,Quel plat brésilien mijoté associe haricots noirs et viandes de porc ?,La feijoada,Le churrasco,Le pão de queijo,La moqueca,1,La feijoada est considérée comme le plat national brésilien.,4
497,Gastronomie,Quel pays est le plus grand consommateur de thé par habitant ?,Le Royaume-Uni,La Turquie,La Chine,L'Inde,2,La Turquie devance largement le Royaume-Uni en consommation de thé par habitant.,4
498,Gastronomie,Quel fruit contient une enzyme qui empêche la gélatine de prendre ?,La pomme,L'ananas,La banane,La poire,2,La broméline de l'ananas frais dégrade les protéines de la gélatine.,4
499,Gastronomie,Quelle pâtisserie marocaine sucrée-salée est à base de pigeon ou de poulet ?,La pastilla,Le baklava,Le makrout,La chebakia,1,"La pastilla associe feuilles de brick, viande, amandes et sucre glace.",4
500,Gastronomie,Quelle est la spécialité de Naples inscrite au patrimoine immatériel de l'UNESCO en 2017 ?,Les spaghettis,L'art du pizzaiolo napolitain,Le limoncello,La mozzarella,2,L'UNESCO a inscrit le savoir-faire des pizzaiolos napolitains en 2017.,4
501,Gastronomie,Quelle partie du safran est récoltée ?,La graine,Le stigmate de la fleur,La racine,La feuille,2,On récolte à la main les trois stigmates rouges de chaque fleur de crocus.,4
502,Gastronomie,Quel cuisinier a codifié la cuisine française moderne au début du XXe siècle ?,Carême,Auguste Escoffier,Bocuse,Robuchon,2,Escoffier a organisé la brigade de cuisine et codifié les sauces dans son 'Guide culinaire' (1903).,4
503,Gastronomie,Quel ingrédient donne son goût caractéristique à l'absinthe ?,L'anis et la grande absinthe,La menthe,Le genièvre,Le fenouil seul,1,"L'absinthe associe grande absinthe, anis vert et fenouil.",4
504,Gastronomie,Combien de temps un comté peut-il être affiné au maximum en pratique ?,3 mois,Plus de 3 ans,2 semaines,10 ans,2,"Les comtés d'exception peuvent être affinés plus de 36 mois, développant des notes très complexes.",4
505,Géographie,Quelle est la capitale de la France ?,Paris,Lyon,Marseille,Toulouse,1,Paris est la capitale de la France depuis le Moyen Âge.,1
506,Géographie,Quel est le plus grand océan du monde ?,Océan Pacifique,Océan Atlantique,Océan Indien,Océan Arctique,1,Le Pacifique couvre à lui seul environ un tiers de la surface terrestre.,1
507,Géographie,Sur quel continent se trouve l'Égypte ?,Afrique,Asie,Europe,Amérique du Sud,1,L'Égypte est située dans le nord-est du continent africain.,1
508,Géographie,Quel fleuve traverse la ville de Paris ?,La Seine,La Loire,Le Rhône,La Garonne,1,La Seine relie Paris à la Manche.,1
509,Géographie,Quel est le plus grand désert chaud du monde ?,Le Sahara,Le désert de Gobi,Le Kalahari,Le désert d'Arabie,1,Le Sahara s'étend sur une grande partie du nord de l'Afrique.,1
510,Géographie,Quel est le plus haut sommet du monde ?,L'Everest,Le K2,Le Kangchenjunga,Le Lhotse,1,L'Everest culmine à 8 849 mètres à la frontière entre le Népal et le Tibet.,1
511,Géographie,Quel océan borde la côte est des États-Unis ?,L'océan Atlantique,L'océan Pacifique,L'océan Indien,L'océan Arctique,1,La côte est américaine fait face à l'Europe de l'autre côté de l'Atlantique.,1
512,Géographie,Quel pays possède le plus grand territoire du monde ?,La Russie,Le Canada,La Chine,Les États-Unis,1,La Russie s'étend sur onze fuseaux horaires.,1
513,Géographie,Quel fleuve traverse l'Égypte du sud au nord ?,Le Nil,Le Congo,Le Niger,Le Zambèze,1,Le Nil se jette dans la Méditerranée après avoir traversé l'Égypte.,1
514,Géographie,Quel est le plus grand pays d'Amérique du Sud ?,Le Brésil,L'Argentine,La Colombie,Le Pérou,1,Le Brésil couvre près de la moitié de la superficie du continent sud-américain.,1
515,Géographie,Quelle chaîne de montagnes sépare la France de l'Espagne ?,Les Pyrénées,Les Alpes,Le Massif Central,Le Jura,1,Cette chaîne s'étend d'ouest en est le long de la frontière franco-espagnole.,1
516,Géographie,Quelle île méditerranéenne est à la fois une région française et le lieu de naissance de Napoléon ?,La Corse,La Sardaigne,La Sicile,Malte,1,Napoléon Bonaparte est né à Ajaccio en 1769.,1
517,Géographie,Quel fleuve traverse Londres ?,La Tamise,La Severn,L'Avon,La Mersey,1,La Tamise traverse la capitale britannique d'ouest en est.,1
518,Géographie,Quelle chaîne de montagnes sépare l'Inde du Népal et du Tibet ?,L'Himalaya,L'Hindou Kouch,Le Karakoram,Les monts Altaï,1,"Cette chaîne abrite les plus hauts sommets du monde, dont l'Everest.",1
519,Géographie,"Quel pays possède la plus grande forêt tropicale du monde, la forêt amazonienne ?",Le Brésil,La Colombie,Le Pérou,Le Venezuela,1,Le Brésil abrite environ 60% de la forêt amazonienne.,1
520,Géographie,Quel océan sépare l'Amérique du Sud de l'Afrique ?,L'océan Atlantique,L'océan Pacifique,L'océan Indien,L'océan Austral,1,Cet océan s'étend entre les deux continents d'est en ouest.,1
521,Géographie,"Quelle mer borde la Libye, la Tunisie et l'Algérie au nord ?",La mer Méditerranée,La mer Rouge,La mer Noire,La mer Adriatique,1,Ces trois pays d'Afrique du Nord ont une large façade sur cette mer.,1
522,Géographie,Quel est généralement considéré comme le plus long fleuve du monde ?,Le Nil,L'Amazone,Le Yangtsé,Le Mississippi,1,Le Nil traverse plusieurs pays d'Afrique de l'Est.,2
523,Géographie,Quelle chaîne de montagnes est traditionnellement considérée comme la frontière entre l'Europe et l'Asie ?,L'Oural,Les Alpes,L'Himalaya,Les Andes,1,Cette chaîne s'étend sur plusieurs milliers de kilomètres en Russie.,2
524,Géographie,Quel détroit sépare l'Europe de l'Afrique ?,Le détroit de Gibraltar,Le détroit de Béring,Le détroit de Malacca,Le détroit du Bosphore,1,Ce détroit relie l'océan Atlantique à la mer Méditerranée.,2
525,Géographie,Quel est le point culminant du continent africain ?,Le Kilimandjaro,Le mont Kenya,Le Ras Dashen,Le mont Toubkal,1,Ce volcan situé en Tanzanie culmine à environ 5 895 mètres.,2
526,Géographie,"Quelle mer est bordée par l'Égypte, l'Arabie saoudite et le Soudan ?",La mer Rouge,La mer Noire,La mer Caspienne,La mer d'Oman,1,Cette mer sépare l'Afrique de la péninsule arabique.,2
527,Géographie,Quel continent abrite le plus grand nombre de pays ?,L'Afrique,L'Asie,L'Europe,L'Amérique du Sud,1,L'Afrique compte 54 pays reconnus par l'ONU.,2
528,Géographie,Quelle est la plus grande île du monde ?,Le Groenland,La Nouvelle-Guinée,Bornéo,Madagascar,1,"Le Groenland, territoire danois, est bien plus vaste que l'Australie qui est classée comme continent.",2
529,Géographie,Quel pays est traversé par le cercle polaire arctique et compte de nombreux fjords ?,La Norvège,La Suède,La Finlande,Le Danemark,1,La Norvège possède un littoral découpé par de nombreux fjords glaciaires.,2
530,Géographie,Quelle chaîne de montagnes traverse toute l'Amérique du Sud le long de sa côte ouest ?,Les Andes,Les Rocheuses,Les Appalaches,La Sierra Madre,1,Les Andes forment la plus longue chaîne de montagnes continentale du monde.,2
531,Géographie,Quel volcan italien domine la baie de Naples ?,Le Vésuve,L'Etna,Le Stromboli,Le Vulcano,1,Ce volcan a détruit la ville antique de Pompéi en 79 après J.-C.,2
532,Géographie,Quel fleuve se jette dans la mer du Nord après avoir traversé l'Allemagne et les Pays-Bas ?,Le Rhin,L'Elbe,La Meuse,L'Escaut,1,Le Rhin prend sa source en Suisse avant de traverser plusieurs pays européens.,2
533,Géographie,Quel pays est bordé par la mer Baltique au nord et compte de nombreux lacs ?,La Finlande,La Norvège,L'Islande,Le Danemark,1,La Finlande est parfois surnommée le 'pays des mille lacs'.,2
534,Géographie,Comment surnomme-t-on la vaste zone désertique du centre de l'Australie ?,L'Outback,Le Bush vert,La Pampa,Le Veld,1,"L'Outback désigne l'immense intérieur aride et semi-aride de l'Australie, très faiblement peuplé.",2
535,Géographie,Quelle mer sépare l'Italie de la péninsule balkanique ?,La mer Adriatique,La mer Tyrrhénienne,La mer Ionienne,La mer Égée,1,Cette mer borde notamment Venise à son extrémité nord.,2
536,Géographie,"Quelle capitale européenne, célèbre pour ses vestiges antiques, est bâtie sur sept collines ?",Rome,Lisbonne,Athènes,Édimbourg,1,Rome est traditionnellement dite bâtie sur sept collines.,2
537,Géographie,"Quelle chaîne de montagnes abrite le mont Blanc, point culminant de l'Europe occidentale ?",Les Alpes,Les Pyrénées,Les Carpates,Le Caucase,1,Le mont Blanc culmine à environ 4 805 mètres à la frontière franco-italienne.,2
538,Géographie,"Quelle région désertique s'étend entre l'Algérie, le Mali et le Niger ?",Le Sahara,Le Sahel,Le Kalahari,Le Namib,1,Le Sahara est le plus vaste désert chaud du monde.,2
539,Géographie,Quel canal artificiel relie la mer Méditerranée à la mer Rouge ?,Le canal de Suez,Le canal de Panama,Le canal de Corinthe,Le canal de Kiel,1,Ce canal égyptien a été inauguré en 1869.,2
540,Géographie,Quel canal artificiel relie l'océan Atlantique à l'océan Pacifique en Amérique centrale ?,Le canal de Panama,Le canal de Suez,Le canal de Nicaragua,Le canal de Corinthe,1,Ce canal a été achevé en 1914 et raccourcit considérablement les routes maritimes.,2
541,Géographie,Quel fleuve traverse Rome ?,Le Tibre,L'Arno,Le Pô,L'Adige,1,Le Tibre traverse la capitale italienne du nord au sud.,2
542,Géographie,"Quelle région polaire est un continent recouvert de glace, sans population permanente ?",L'Antarctique,Le Groenland,La Sibérie,L'Arctique,1,L'Antarctique est régi par un traité international interdisant toute exploitation militaire ou minière.,2
543,Géographie,Quelle chaîne de montagnes traverse l'ouest des États-Unis et du Canada ?,Les Rocheuses,Les Appalaches,La Sierra Nevada,Les Cascades,1,Les Rocheuses s'étendent du Nouveau-Mexique jusqu'en Colombie-Britannique.,2
544,Géographie,Quel golfe sépare la péninsule arabique de l'Iran ?,Le golfe Persique,Le golfe d'Oman,La mer Rouge,Le golfe d'Aden,1,Cette zone maritime est riche en gisements de pétrole.,2
545,Géographie,Quelle capitale est traversée par le fleuve Danube ?,Budapest,Varsovie,Prague,Bucarest,1,"Budapest est en réalité composée de deux villes, Buda et Pest, réunies par le fleuve.",2
546,Géographie,Quel océan borde à la fois l'Australie et l'Afrique du Sud ?,L'océan Indien,L'océan Pacifique,L'océan Atlantique,L'océan Arctique,1,"Cet océan s'étend entre l'Afrique, l'Asie et l'Océanie.",2
547,Géographie,Quel détroit sépare l'Asie de l'Amérique du Nord ?,Le détroit de Béring,Le détroit de Gibraltar,Le détroit de Malacca,Le détroit d'Ormuz,1,Ce détroit sépare la Sibérie de l'Alaska.,2
548,Géographie,"Quel pays est situé entre l'Inde et la Chine, dans l'Himalaya ?",Le Népal,Le Bhoutan,Le Bangladesh,Le Sri Lanka,1,Le Népal abrite le mont Everest sur sa frontière avec le Tibet.,2
549,Géographie,Quelle mer sépare la Grèce de la Turquie ?,La mer Égée,La mer Ionienne,La mer Noire,La mer de Marmara,1,Cette mer est parsemée de nombreuses îles grecques.,2
550,Géographie,Quelle île de l'océan Indien est un pays indépendant connu pour sa biodiversité unique ?,Madagascar,Les Comores,Maurice,Les Seychelles,1,Madagascar abrite de nombreuses espèces endémiques comme les lémuriens.,2
551,Géographie,Quelle mer borde la Croatie et une partie de l'Italie ?,La mer Adriatique,La mer Ionienne,La mer Égée,La mer Tyrrhénienne,1,La côte croate le long de cette mer est réputée pour ses nombreuses îles.,2
552,Géographie,Quel fleuve prend sa source en Suisse et se jette dans la mer du Nord ?,Le Rhin,Le Rhône,Le Danube,L'Elbe,1,"Le Rhin traverse la Suisse, l'Allemagne et les Pays-Bas.",2
553,Géographie,Quel fleuve se jette dans le golfe du Mexique après avoir traversé les États-Unis du nord au sud ?,Le Mississippi,Le Missouri,L'Ohio,Le Colorado,1,Le Mississippi est l'un des plus longs fleuves d'Amérique du Nord.,2
554,Géographie,Quel fleuve marque une partie de la frontière entre la France et l'Allemagne ?,Le Rhin,La Moselle,La Sarre,La Meuse,1,Le Rhin sépare notamment l'Alsace du Bade-Wurtemberg.,2
555,Géographie,Quelle étendue d'eau entre l'Amérique du Nord et les Caraïbes a donné son nom au Gulf Stream ?,Le golfe du Mexique,Le golfe de Californie,La mer des Caraïbes,Le golfe d'Alaska,1,Ce golfe reçoit les eaux du fleuve Mississippi.,2
556,Géographie,Quel fleuve traverse la ville de Vienne en Autriche ?,Le Danube,Le Rhin,L'Inn,La Drave,1,Le Danube traverse la capitale autrichienne d'ouest en est.,2
557,Géographie,Quel est le plus petit État du monde en superficie ?,Le Vatican,Monaco,Saint-Marin,Le Liechtenstein,1,"Cet État enclavé dans Rome ne mesure qu'environ 0,44 km².",3
558,Géographie,Quel est le point culminant de l'Amérique du Sud ?,L'Aconcagua,Le Chimborazo,Le Huascarán,Le Cotopaxi,1,Ce sommet argentin dépasse 6 900 mètres d'altitude.,3
559,Géographie,Quel est le plus grand pays d'Afrique par sa superficie ?,L'Algérie,La République démocratique du Congo,Le Soudan,La Libye,1,L'Algérie est le plus grand pays d'Afrique depuis la partition du Soudan en 2011.,3
560,Géographie,Quel désert couvre une grande partie du nord du Chili ?,Le désert d'Atacama,Le désert de Sonora,Le désert de Patagonie,Le désert de Mojave,1,L'Atacama est considéré comme l'un des endroits les plus arides du monde.,3
561,Géographie,Quel pays possède le plus de fuseaux horaires terrestres ?,La France,La Russie,Les États-Unis,La Chine,1,"Grâce à ses territoires d'outre-mer, la France couvre douze fuseaux horaires.",3
562,Géographie,Quelle mer est entièrement enclavée et considérée comme le plus grand plan d'eau intérieur du monde ?,La mer Caspienne,La mer d'Aral,La mer Morte,Le lac Baïkal,1,"La mer Caspienne est bordée par la Russie, le Kazakhstan, l'Iran, l'Azerbaïdjan et le Turkménistan.",3
563,Géographie,Quel fleuve est le plus long d'Europe ?,La Volga,Le Danube,Le Rhin,L'Oural,1,La Volga traverse la Russie sur plus de 3 500 kilomètres.,3
564,Géographie,"Quel pays est bordé par treize pays différents, un record mondial partagé avec la Russie ?",La Chine,Le Brésil,L'Inde,Le Kazakhstan,1,La Chine et la Russie partagent le record du plus grand nombre de frontières terrestres.,3
565,Géographie,Quelle capitale se situe à la plus haute altitude d'Amérique du Sud ?,La Paz,Quito,Bogotá,Lima,1,"La Paz, siège du gouvernement bolivien, se trouve à plus de 3 600 mètres d'altitude.",3
566,Géographie,Quel archipel volcanique appartient à l'Équateur et abrite une faune unique étudiée par Darwin ?,Les îles Galápagos,Les Canaries,Les Açores,Les Maldives,1,Charles Darwin y a développé une partie de sa théorie de l'évolution.,3
567,Géographie,"Quel vaste plateau d'Asie centrale, le plus élevé du monde, est surnommé le 'toit du monde' ?",Le plateau tibétain,Le plateau du Deccan,Le plateau du Colorado,Le plateau iranien,1,Ce plateau abrite les sources de plusieurs grands fleuves asiatiques.,3
568,Géographie,"Quel pays africain possède les chutes Victoria, partagées avec un voisin ?",La Zambie,Le Kenya,La Tanzanie,L'Ouganda,1,Ces chutes sont partagées entre la Zambie et le Zimbabwe sur le fleuve Zambèze.,3
569,Géographie,Quel phénomène géologique explique la forte activité volcanique et sismique du Japon ?,L'érosion glaciaire,La subduction de plaques tectoniques,Les courants marins,Les moussons,2,Le Japon se situe à la rencontre de plusieurs plaques tectoniques : leur subduction alimente volcans et séismes.,3
570,Géographie,Quel océan est le plus petit du monde ?,L'océan Arctique,L'océan Indien,L'océan Atlantique,L'océan Austral,1,L'océan Arctique est en grande partie recouvert de banquise.,3
