id,theme,question,reponse_1,reponse_2,reponse_3,reponse_4,bonne_reponse,explication,difficulte
1,Acteurs/Célébrités,Quel acteur est surnommé 'The Rock' ?,Dwayne Johnson,Vin Diesel,Jason Statham,Terry Crews,1,"Dwayne Johnson, ancien catcheur, a gardé ce surnom en devenant acteur.",1
2,Acteurs/Célébrités,Quelle chanteuse est surnommée 'Queen of Pop' ?,Madonna,Britney Spears,Beyoncé,Lady Gaga,1,Madonna a été surnommée ainsi dès les années 1980 pour son influence sur la musique pop.,1
3,Acteurs/Célébrités,Quel acteur incarne Jack Dawson aux côtés de Kate Winslet dans 'Titanic' ?,Leonardo DiCaprio,Brad Pitt,Matt Damon,Tom Cruise,1,Leonardo DiCaprio incarne ce personnage dans ce film de James Cameron sorti en 1997.,1
4,Acteurs/Célébrités,Quel chanteur est connu comme 'le Roi de la Pop' ?,Michael Jackson,Prince,Elvis Presley,Stevie Wonder,1,Michael Jackson a reçu ce surnom au sommet de sa carrière dans les années 1980.,1
5,Acteurs/Célébrités,Quel acteur incarne l'agent Ethan Hunt dans la saga 'Mission Impossible' ?,Tom Cruise,Tom Hanks,Brad Pitt,Matt Damon,1,Tom Cruise interprète Ethan Hunt depuis 1996 dans cette franchise.,1
6,Acteurs/Célébrités,Quel chanteur britannique est connu pour le titre 'Shape of You' ?,Ed Sheeran,Sam Smith,Harry Styles,James Blunt,1,Cette chanson figure parmi les titres les plus streamés de l'histoire.,1
7,Acteurs/Célébrités,Quel acteur est célèbre pour son rôle dans 'Forrest Gump' ?,Tom Hanks,Kevin Costner,Robin Williams,Bill Murray,1,Tom Hanks a remporté deux Oscars consécutifs au début des années 1990.,1
8,Acteurs/Célébrités,Quelle chanteuse est surnommée la 'Queen Bey' ?,Beyoncé,Rihanna,Alicia Keys,Mariah Carey,1,Beyoncé a débuté sa carrière au sein du groupe Destiny's Child.,1
9,Acteurs/Célébrités,Quelle actrice française a joué dans 'Amélie Poulain' ?,Audrey Tautou,Marion Cotillard,Sophie Marceau,Juliette Binoche,1,Audrey Tautou incarne le personnage principal de ce film sorti en 2001.,1
10,Acteurs/Célébrités,Quel musicien est le leader du groupe Queen ?,Freddie Mercury,Brian May,Roger Taylor,John Deacon,1,Freddie Mercury a été le chanteur principal du groupe jusqu'à sa mort en 1991.,1
11,Acteurs/Célébrités,Quel acteur incarne Spider-Man dans 'No Way Home' ?,Tom Holland,Andrew Garfield,Tobey Maguire,Timothée Chalamet,1,Tom Holland interprète Peter Parker dans l'univers cinématographique Marvel depuis 2016.,1
12,Acteurs/Célébrités,Quelle chanteuse britannique est l'autrice du titre 'Hello' sorti en 2015 ?,Adele,Sam Smith,Ed Sheeran,Sia,1,Adele est une chanteuse britannique reconnue pour sa voix puissante.,1
13,Acteurs/Célébrités,Quelle actrice est connue pour son rôle dans 'Pretty Woman' ?,Julia Roberts,Meg Ryan,Sandra Bullock,Demi Moore,1,Julia Roberts y incarne une jeune femme rencontrant un homme d'affaires incarné par Richard Gere.,1
14,Acteurs/Célébrités,Quelle chanteuse américaine est connue pour le titre 'Rolling in the Deep' ?,Adele,Amy Winehouse,Duffy,Florence Welch,1,Cette chanson figure sur l'album '21' sorti en 2011.,1
15,Acteurs/Célébrités,"Quelle actrice, ancienne Miss Israël, incarne Wonder Woman depuis 2016 ?",Gal Gadot,Brie Larson,Margot Robbie,Scarlett Johansson,1,Gal Gadot incarne ce personnage depuis 'Batman v Superman'.,1
16,Acteurs/Célébrités,Quel acteur a relancé sa carrière grâce au rôle de Tony Stark débuté en 2008 ?,Robert Downey Jr.,Chris Evans,Chris Hemsworth,Mark Ruffalo,1,Robert Downey Jr. incarne Iron Man dans l'univers Marvel depuis 2008.,1
17,Acteurs/Célébrités,Quel musicien est surnommé le 'Roi du Rock' dès la fin des années 1950 ?,Elvis Presley,Chuck Berry,Little Richard,Jerry Lee Lewis,1,Elvis Presley a été surnommé ainsi dès la fin des années 1950.,1
18,Acteurs/Célébrités,Quelle chanteuse est connue pour le titre 'Bad Romance' sorti en 2009 ?,Lady Gaga,Katy Perry,Rihanna,Kesha,1,Cette chanson figure sur l'album 'The Fame Monster'.,1
19,Acteurs/Célébrités,Quelle chanteuse italo-américaine est connue pour le titre 'Poker Face' ?,Lady Gaga,Katy Perry,Christina Aguilera,Pink,1,Cette chanson sortie en 2008 a contribué à lancer la carrière internationale de l'artiste.,1
20,Acteurs/Célébrités,Quelle chanteuse américaine est connue pour l'album '1989' et le titre 'Shake It Off' ?,Taylor Swift,Katy Perry,Selena Gomez,Demi Lovato,1,Cet album sorti en 2014 marque le virage pop de l'artiste.,1
21,Acteurs/Célébrités,Quel chanteur canadien est connu pour le titre 'Blinding Lights' ?,The Weeknd,Drake,Justin Bieber,Shawn Mendes,1,Cette chanson sortie en 2019 figure parmi les titres les plus streamés au monde.,1
22,Acteurs/Célébrités,Quelle actrice a joué dans 'La Vie en rose' en incarnant Édith Piaf ?,Marion Cotillard,Audrey Tautou,Juliette Binoche,Léa Seydoux,1,Marion Cotillard a remporté l'Oscar de la meilleure actrice pour ce rôle en 2008.,2
23,Acteurs/Célébrités,Quelle actrice incarne 'la Mariée' dans 'Kill Bill' ?,Uma Thurman,Cameron Diaz,Nicole Kidman,Charlize Theron,1,Uma Thurman y incarne une tueuse en quête de vengeance.,2
24,Acteurs/Célébrités,Quelle actrice incarne la reine Élisabeth II dans les deux premières saisons de 'The Crown' ?,Claire Foy,Olivia Colman,Imelda Staunton,Helena Bonham Carter,1,Claire Foy interprète la reine dans les deux premières saisons de la série.,2
25,Acteurs/Célébrités,Quel acteur a également joué dans 'Big' avant 'Forrest Gump' ?,Tom Hanks,Kevin Costner,Michael Keaton,Bill Murray,1,"Tom Hanks a joué dans 'Big' en 1988, avant 'Forrest Gump' en 1994.",2
26,Acteurs/Célébrités,Quelle chanteuse québécoise est connue pour sa puissance vocale et le titre 'My Heart Will Go On' ?,Céline Dion,Mylène Farmer,Patricia Kaas,Zaz,1,Céline Dion a interprété la chanson thème du film 'Titanic'.,2
27,Acteurs/Célébrités,Quel acteur incarne Wolverine et a aussi mené une carrière de chanteur à Broadway ?,Hugh Jackman,Ryan Reynolds,Chris Evans,Jake Gyllenhaal,1,Hugh Jackman a mené une carrière de chanteur et danseur sur scène en parallèle du cinéma.,2
28,Acteurs/Célébrités,Quelle actrice interprète Cersei Lannister dans 'Game of Thrones' ?,Lena Headey,Emilia Clarke,Sophie Turner,Maisie Williams,1,Lena Headey interprète la reine régente tout au long de la série.,2
29,Acteurs/Célébrités,Quel acteur français a joué dans 'Intouchables' aux côtés d'Omar Sy ?,François Cluzet,Jean Dujardin,Daniel Auteuil,Gérard Depardieu,1,François Cluzet y incarne un tétraplégique fortuné aidé par un jeune homme de banlieue.,2
30,Acteurs/Célébrités,Quel chanteur est le leader du groupe U2 ?,Bono,The Edge,Adam Clayton,Larry Mullen Jr.,1,Bono est le chanteur principal de ce groupe irlandais formé en 1976.,2
31,Acteurs/Célébrités,Quelle actrice a remporté un Oscar pour son rôle dans 'Black Swan' ?,Natalie Portman,Mila Kunis,Winona Ryder,Vera Farmiga,1,Natalie Portman y incarne une danseuse étoile sombrant dans la folie.,2
32,Acteurs/Célébrités,Quel acteur incarne l'agent Harry Hart dans la saga 'Kingsman' ?,Colin Firth,Taron Egerton,Mark Strong,Michael Caine,1,Colin Firth interprète cet agent chevronné du service secret Kingsman.,2
33,Acteurs/Célébrités,Quel acteur incarne Neo dans 'Matrix' ?,Keanu Reeves,Hugo Weaving,Laurence Fishburne,Carrie-Anne Moss,1,"Keanu Reeves incarne Thomas Anderson, alias Neo, dans la trilogie originale.",2
34,Acteurs/Célébrités,"Quelle actrice a collaboré à plusieurs reprises avec Quentin Tarantino, notamment dans 'Kill Bill' ?",Uma Thurman,Daryl Hannah,Lucy Liu,Vivica A. Fox,1,Uma Thurman a tourné dans plusieurs films du réalisateur.,2
35,Acteurs/Célébrités,Quel acteur a été révélé au grand public grâce à son rôle dans 'Le Parrain' en 1972 ?,Al Pacino,Robert De Niro,James Caan,Andy Garcia,1,Al Pacino incarne Michael Corleone dans cette trilogie.,2
36,Acteurs/Célébrités,Quelle chanteuse américaine interprète 'I Will Always Love You' dans le film 'Bodyguard' ?,Whitney Houston,Mariah Carey,Toni Braxton,Celine Dion,1,Whitney Houston reprend cette chanson à l'origine écrite par Dolly Parton.,2
37,Acteurs/Célébrités,Quel acteur interprète Sherlock Holmes dans les films réalisés par Guy Ritchie ?,Robert Downey Jr.,Jude Law,Benedict Cumberbatch,Ian McKellen,1,Robert Downey Jr. incarne le détective aux côtés de Jude Law dans le rôle de Watson.,2
38,Acteurs/Célébrités,Quelle actrice française a remporté un César pour son rôle dans 'La Môme' ?,Marion Cotillard,Audrey Tautou,Sandrine Bonnaire,Isabelle Huppert,1,Ce film raconte la vie de la chanteuse Édith Piaf.,2
39,Acteurs/Célébrités,"Quel acteur a collaboré à de nombreuses reprises avec Tim Burton, notamment dans 'Edward aux mains d'argent' ?",Johnny Depp,Christian Bale,Michael Keaton,Ewan McGregor,1,Johnny Depp a tourné dans de nombreux films du réalisateur.,2
40,Acteurs/Célébrités,Quelle chanteuse a incarné le rôle-titre du film 'A Star Is Born' aux côtés de Bradley Cooper ?,Lady Gaga,Beyoncé,Rihanna,Ariana Grande,1,Lady Gaga a été nommée aux Oscars pour cette performance en 2018.,2
41,Acteurs/Célébrités,Quel acteur britannique a incarné Gandalf dans 'Le Seigneur des Anneaux' ?,Ian McKellen,Ian Holm,Christopher Lee,Anthony Hopkins,1,Ian McKellen interprète ce magicien dans les six films de la trilogie et de la préquelle.,2
42,Acteurs/Célébrités,Quelle actrice a été nommée aux Oscars pour son rôle d'Elizabeth Bennet dans 'Orgueil et Préjugés' (2005) ?,Keira Knightley,Emma Thompson,Kate Winslet,Rosamund Pike,1,Keira Knightley a été nommée aux Oscars pour cette interprétation.,2
43,Acteurs/Célébrités,"Quel acteur interprète Dexter Morgan, expert légiste menant une double vie de tueur ?",Michael C. Hall,Jon Hamm,Kevin Bacon,Michael Shannon,1,Michael C. Hall interprète ce personnage dans la série 'Dexter'.,2
44,Acteurs/Célébrités,Quel chanteur belge est connu pour le titre 'Formidable' sorti en 2013 ?,Stromae,Christophe Maé,Vianney,Grand Corps Malade,1,Stromae a connu un succès international avec cette chanson.,2
45,Acteurs/Célébrités,Quel acteur interprète Aragorn dans la trilogie 'Le Seigneur des Anneaux' ?,Viggo Mortensen,Orlando Bloom,Sean Bean,Karl Urban,1,Viggo Mortensen interprète ce personnage tout au long de la trilogie de Peter Jackson.,2
46,Acteurs/Célébrités,Quel chanteur est le leader du groupe The Rolling Stones depuis sa formation en 1962 ?,Mick Jagger,Keith Richards,Charlie Watts,Ronnie Wood,1,Mick Jagger est le chanteur principal du groupe depuis sa formation.,2
47,Acteurs/Célébrités,Quel acteur incarne le courtier Jordan Belfort dans 'Le Loup de Wall Street' ?,Leonardo DiCaprio,Matthew McConaughey,Jonah Hill,Kevin Spacey,1,Leonardo DiCaprio y incarne ce courtier dans ce film de Martin Scorsese.,2
48,Acteurs/Célébrités,Quel chanteur portoricain est connu pour le titre 'Despacito' sorti en 2017 ?,Luis Fonsi,Enrique Iglesias,Ricky Martin,Marc Anthony,1,Cette chanson est devenue l'un des titres les plus streamés au monde.,2
49,Acteurs/Célébrités,"Quel chanteur est l'auteur de l'album 'Thriller' sorti en 1982, le plus vendu de l'histoire ?",Michael Jackson,Prince,Stevie Wonder,Lionel Richie,1,Cet album s'est vendu à plusieurs dizaines de millions d'exemplaires.,2
50,Acteurs/Célébrités,Quel acteur incarne le rôle principal masculin dans 'Notting Hill' aux côtés de Julia Roberts ?,Hugh Grant,Colin Firth,Jude Law,Ewan McGregor,1,Hugh Grant y interprète un libraire londonien tombant amoureux d'une star de cinéma.,2
51,Acteurs/Célébrités,Quelle actrice incarne Bridget Jones dans la saga du même nom ?,Renée Zellweger,Kate Winslet,Emma Thompson,Keira Knightley,1,Renée Zellweger a pris l'accent britannique pour ce rôle emblématique.,2
52,Acteurs/Célébrités,Quel chanteur est le fondateur du groupe The Beatles avec Paul McCartney ?,John Lennon,George Harrison,Ringo Starr,Pete Best,1,John Lennon et Paul McCartney ont co-écrit la majorité des chansons du groupe.,2
53,Acteurs/Célébrités,Quelle actrice britannique est connue pour son rôle de M dans plusieurs films James Bond ?,Judi Dench,Helen Mirren,Maggie Smith,Vanessa Redgrave,1,Judi Dench a incarné ce personnage de 1995 à 2012.,2
54,Acteurs/Célébrités,Quel chanteur belge est l'auteur de 'Ne me quitte pas' ?,Jacques Brel,Serge Gainsbourg,Charles Aznavour,Léo Ferré,1,"Jacques Brel a écrit et interprété 'Ne me quitte pas' en 1959, l'une des chansons françaises les plus reprises au monde.",2
55,Acteurs/Célébrités,Quel acteur a incarné le détective Columbo dans la série télévisée éponyme ?,Peter Falk,Telly Savalas,Karl Malden,William Conrad,1,Peter Falk a interprété ce détective à l'imperméable froissé pendant plus de trente ans.,2
56,Acteurs/Célébrités,Quel musicien est connu comme le guitariste virtuose du groupe Guns N' Roses ?,Slash,Izzy Stradlin,Duff McKagan,Axl Rose,1,Slash est reconnaissable à son chapeau haut-de-forme et sa longue chevelure.,2
57,Acteurs/Célébrités,Quelle actrice incarne Elle Woods dans 'La Revanche d'une blonde' ?,Reese Witherspoon,Kirsten Dunst,Amanda Bynes,Alicia Silverstone,1,Reese Witherspoon y incarne une étudiante blonde sous-estimée à Harvard.,2
58,Acteurs/Célébrités,Quel musicien est le chanteur du groupe Coldplay ?,Chris Martin,Jonny Buckland,Guy Berryman,Will Champion,1,Chris Martin a formé ce groupe britannique à Londres en 1996.,2
59,Acteurs/Célébrités,Quel acteur incarne le rôle principal dans 'Il faut sauver le soldat Ryan' ?,Tom Hanks,Matt Damon,Vin Diesel,Edward Burns,1,Tom Hanks y incarne un capitaine chargé de retrouver un soldat derrière les lignes ennemies.,2
60,Acteurs/Célébrités,Quelle actrice incarne Andy Sachs dans 'Le Diable s'habille en Prada' ?,Anne Hathaway,Meryl Streep,Emily Blunt,Amanda Seyfried,1,Anne Hathaway y incarne une jeune assistante travaillant pour une rédactrice de mode exigeante.,2
61,Acteurs/Célébrités,Quelle chanteuse est connue pour le titre 'Toxic' sorti en 2003 ?,Britney Spears,Christina Aguilera,Jessica Simpson,Mandy Moore,1,Cette chanson figure sur l'album 'In the Zone'.,2
62,Acteurs/Célébrités,Quel acteur incarne le rôle principal dans 'Le Fabuleux Destin d'Amélie Poulain' aux côtés d'Audrey Tautou ?,Mathieu Kassovitz,Jamel Debbouze,Gaspard Ulliel,Romain Duris,1,"Mathieu Kassovitz y incarne Nino, l'amoureux timide d'Amélie.",2
63,Acteurs/Célébrités,Quel acteur britannique a incarné James Bond dans sept films entre 1973 et 1985 ?,Roger Moore,Sean Connery,Daniel Craig,Pierce Brosnan,1,Roger Moore détient le record de films dans le rôle de James Bond.,3
64,Acteurs/Célébrités,Quel musicien britannique a co-écrit une grande partie des albums conceptuels de Pink Floyd ?,Roger Waters,David Gilmour,Nick Mason,Richard Wright,1,Roger Waters a co-écrit une grande partie des albums conceptuels du groupe.,3
65,Acteurs/Célébrités,Quelle actrice a incarné la reine Élisabeth Ire dans 'Elizabeth' (1998) ?,Cate Blanchett,Judi Dench,Helen Mirren,Emily Blunt,1,Cate Blanchett a incarné ce rôle dans ce film sorti en 1998.,3
66,Acteurs/Célébrités,Quel chanteur américain est surnommé le 'Boss' et dirige le E Street Band ?,Bruce Springsteen,Bob Dylan,Neil Young,Tom Petty,1,Bruce Springsteen a acquis ce surnom grâce à des décennies de tournées.,3
67,Acteurs/Célébrités,Quelle actrice incarne Furiosa jeune dans le film préquelle 'Furiosa' (2024) ?,Anya Taylor-Joy,Zendaya,Florence Pugh,Sydney Sweeney,1,Anya Taylor-Joy reprend ce rôle initialement incarné par Charlize Theron.,3
68,Acteurs/Célébrités,Quelle actrice a remporté l'Oscar pour son rôle dans 'Erin Brockovich' ?,Julia Roberts,Sandra Bullock,Charlize Theron,Reese Witherspoon,1,Julia Roberts y incarne une mère célibataire luttant contre une entreprise pollueuse.,3
69,Acteurs/Célébrités,Quel acteur a remporté l'Oscar pour son rôle du roi George VI dans 'Le Discours d'un roi' ?,Colin Firth,Geoffrey Rush,Tom Hooper,Guy Pearce,1,Colin Firth interprète un roi aux prises avec un bégaiement.,3
70,Acteurs/Célébrités,Quelle chanteuse a sorti l'album visuel 'Lemonade' en 2016 ?,Beyoncé,Rihanna,Solange,Alicia Keys,1,Cet album aborde l'infidélité et l'identité afro-américaine.,3
71,Acteurs/Célébrités,Quelle actrice française est la seule à avoir remporté l'Oscar pour un rôle en langue française ?,Marion Cotillard,Juliette Binoche,Sophie Marceau,Audrey Tautou,1,Elle l'a remporté pour son rôle dans 'La Môme' consacré à Édith Piaf.,3
72,Acteurs/Célébrités,"Quelle actrice a remporté l'Oscar pour son rôle dans 'Still Alice', une femme atteinte d'Alzheimer précoce ?",Julianne Moore,Meryl Streep,Nicole Kidman,Cate Blanchett,1,Julianne Moore a remporté l'Oscar pour ce rôle en 2015.,3
73,Acteurs/Célébrités,"Quel acteur a collaboré à de nombreuses reprises avec Martin Scorsese, notamment dans 'Les Affranchis' ?",Robert De Niro,Al Pacino,Joe Pesci,Ray Liotta,1,Robert De Niro a collaboré à de nombreuses reprises avec le réalisateur depuis les années 1970.,3
74,Acteurs/Célébrités,Quelle actrice a remporté l'Oscar pour son rôle de la reine Élisabeth II dans 'The Queen' (2006) ?,Helen Mirren,Judi Dench,Emma Thompson,Maggie Smith,1,Helen Mirren a remporté l'Oscar de la meilleure actrice pour ce rôle.,3
75,Acteurs/Célébrités,Quel acteur a remporté l'Oscar du meilleur acteur pour 'American Beauty' en 2000 ?,Kevin Spacey,Kevin Costner,Kevin Bacon,Bruce Willis,1,Kevin Spacey a remporté l'Oscar du meilleur acteur pour ce rôle.,3
76,Acteurs/Célébrités,Quelle actrice incarne Marie-Antoinette dans le film de Sofia Coppola sorti en 2006 ?,Kirsten Dunst,Kate Winslet,Natalie Portman,Diane Kruger,1,Kirsten Dunst incarne cette reine dans ce film.,3
77,Acteurs/Célébrités,Quel acteur apparaît dans 'Mamma Mia !' en plus de son rôle dans 'Le Discours d'un roi' ?,Colin Firth,Pierce Brosnan,Hugh Grant,Ewan McGregor,1,Colin Firth apparaît également dans cette comédie musicale sortie en 2008.,3
78,Acteurs/Célébrités,Quel musicien a formé le groupe Nirvana en 1987 ?,Kurt Cobain,Dave Grohl,Krist Novoselic,Pat Smear,1,Kurt Cobain a formé ce groupe emblématique du grunge.,3
79,Acteurs/Célébrités,Quelle actrice incarne la jeune reine dans 'La Jeune Victoria' (2009) ?,Emily Blunt,Jenna Coleman,Judi Dench,Emma Thompson,1,Emily Blunt incarne la reine Victoria dans ce film.,3
80,Acteurs/Célébrités,Quel acteur a remporté l'Oscar pour son rôle dans le biopic 'Ray' consacré à Ray Charles ?,Jamie Foxx,Denzel Washington,Don Cheadle,Terrence Howard,1,Jamie Foxx a remporté l'Oscar du meilleur acteur pour cette performance en 2005.,3
81,Acteurs/Célébrités,Quel acteur incarne le détective privé dans 'Chinatown' (1974) ?,Jack Nicholson,Robert Duvall,Gene Hackman,Dustin Hoffman,1,Jack Nicholson interprète Jake Gittes dans ce film noir de Roman Polanski.,3
82,Acteurs/Célébrités,Quelle actrice incarne Maria von Trapp dans 'La Mélodie du bonheur' ?,Julie Andrews,Audrey Hepburn,Doris Day,Shirley MacLaine,1,Julie Andrews interprète cette gouvernante devenue mère de famille dans ce film musical de 1965.,3
83,Acteurs/Célébrités,Quel musicien américain est connu comme le père fondateur du rock and roll avec le titre 'Johnny B. Goode' ?,Chuck Berry,Little Richard,Fats Domino,Bo Diddley,1,Chuck Berry a fortement influencé les générations de guitaristes rock qui ont suivi.,3
84,Acteurs/Célébrités,Quel acteur incarne Maximus dans 'Gladiator' et a également joué dans 'Master and Commander' ?,Russell Crowe,Colin Farrell,Eric Bana,Gerard Butler,1,Russell Crowe a enchaîné ces deux rôles au début des années 2000.,3
85,Acteurs/Célébrités,"Quel acteur incarne le rôle-titre dans 'Braveheart' (1995), qu'il a aussi réalisé ?",Mel Gibson,Liam Neeson,Russell Crowe,Kevin Costner,1,"Mel Gibson y interprète William Wallace, figure de la résistance écossaise.",3
86,Acteurs/Célébrités,"Quelle actrice incarne fréquemment des rôles comiques, dont dans 'Bridesmaids' ?",Kristen Wiig,Melissa McCarthy,Amy Schumer,Maya Rudolph,1,Kristen Wiig a co-écrit et joué dans cette comédie sortie en 2011.,3
87,Acteurs/Célébrités,Quel acteur incarne le rôle principal dans 'Le Patient anglais' (1996) ?,Ralph Fiennes,Colin Firth,Willem Dafoe,Kristin Scott Thomas,1,Ralph Fiennes y interprète un homme brûlé se remémorant une histoire d'amour tragique.,3
88,Acteurs/Célébrités,Quelle actrice a incarné Cléopâtre dans le film éponyme de 1963 ?,Elizabeth Taylor,Vivien Leigh,Sophia Loren,Ava Gardner,1,Elizabeth Taylor a incarné cette reine d'Égypte dans une production alors la plus coûteuse de l'histoire.,3
89,Acteurs/Célébrités,Quel acteur incarne le professeur Dumbledore dans les deux premiers films Harry Potter ?,Richard Harris,Michael Gambon,Ian McKellen,Alan Rickman,1,Richard Harris a interprété ce rôle avant son remplacement par Michael Gambon après sa mort en 2002.,3
90,Acteurs/Célébrités,Quelle actrice incarne la sorcière Elphaba dans la comédie musicale 'Wicked' au cinéma (2024) ?,Cynthia Erivo,Ariana Grande,Idina Menzel,Kristin Chenoweth,1,Cynthia Erivo interprète ce rôle dans l'adaptation cinématographique sortie en 2024.,3
91,Acteurs/Célébrités,Quel musicien a fondé le label Motown Records à Détroit en 1959 ?,Berry Gordy,Quincy Jones,Smokey Robinson,Marvin Gaye,1,Berry Gordy a fondé ce label devenu emblématique de la musique afro-américaine.,4
92,Acteurs/Célébrités,Quel documentaire de 2015 réalisé par Asif Kapadia retrace la vie et la mort tragique d'une chanteuse britannique de soul ?,Amy,Whitney,Rocketman,Bohemian Rhapsody,1,Ce documentaire retrace la vie et la carrière de la chanteuse.,4
93,Acteurs/Célébrités,Quelle actrice incarne Lisbeth Salander dans la version suédoise originale de 'Millénium' ?,Noomi Rapace,Rooney Mara,Alicia Vikander,Rebecca Ferguson,1,Noomi Rapace incarne cette hackeuse dans la trilogie suédoise.,4
94,Acteurs/Célébrités,Quel acteur incarne le compositeur dans le film 'Amadeus' (1984) ?,Tom Hulce,F. Murray Abraham,Simon Callow,Jeffrey Jones,1,Tom Hulce interprète Mozart dans ce film de Milos Forman.,4
95,Acteurs/Célébrités,Quelle actrice a produit et interprété le rôle-titre du biopic 'Frida' (2002) ?,Salma Hayek,Penélope Cruz,Eva Mendes,Cameron Diaz,1,Salma Hayek a produit et interprété ce rôle consacré à la peintre Frida Kahlo.,4
96,Acteurs/Célébrités,Quel musicien afro-américain est considéré comme le père du blues électrique de Chicago ?,Muddy Waters,B.B. King,Howlin' Wolf,John Lee Hooker,1,Muddy Waters a grandement influencé le rock britannique des années 1960.,4
97,Acteurs/Célébrités,Quel acteur a incarné le rôle principal dans 'Le Roi et moi' au théâtre et au cinéma ?,Yul Brynner,Rex Harrison,Marlon Brando,Charlton Heston,1,Yul Brynner est indissociable de ce rôle qu'il a joué des milliers de fois sur scène.,4
98,Acteurs/Célébrités,Quel acteur incarne le rôle-titre dans 'Lawrence d'Arabie' (1962) ?,Peter O'Toole,Omar Sharif,Alec Guinness,Anthony Quinn,1,Peter O'Toole interprète l'officier britannique T.E. Lawrence dans ce film de David Lean.,4
99,Acteurs/Célébrités,Quel musicien est le fondateur du groupe AC/DC avec son frère Angus Young ?,Malcolm Young,Bon Scott,Brian Johnson,Phil Rudd,1,Malcolm Young a cofondé ce groupe de hard rock australien en 1973.,4
100,Acteurs/Célébrités,"Quel musicien est le batteur emblématique du groupe The Who, connu pour son jeu destructeur ?",Keith Moon,Roger Daltrey,Pete Townshend,John Entwistle,1,Keith Moon était réputé pour détruire son matériel de batterie sur scène.,4
101,Anecdotes,Quel est le seul mammifère naturellement capable de voler ?,L'écureuil volant,La chauve-souris,Le phalanger volant,La roussette géante,2,"Les autres espèces citées ne font que planer, sans réel vol battu.",1
102,Anecdotes,Combien de temps la lumière met-elle à parcourir la distance entre le Soleil et la Terre ?,Environ 8 secondes,Environ 8 minutes,Environ 8 heures,Environ 1 minute,2,"La lumière voyage à environ 300 000 km/s, ce qui représente huit minutes sur cette distance.",1
103,Anecdotes,Quel animal terrestre est le plus rapide sur une courte distance ?,Le lion,Le guépard,L'antilope,Le cheval,2,Le guépard peut atteindre une pointe à plus de 100 km/h sur une centaine de mètres.,1
104,Anecdotes,Quelle catastrophe naturelle se mesure sur l'échelle de Richter ?,Les ouragans,Les inondations,Les séismes,Les éruptions volcaniques,3,Cette échelle logarithmique évalue la magnitude d'un tremblement de terre.,1
105,Anecdotes,Quel animal dort environ 20 heures par jour ?,Le koala,Le cheval,La girafe,Le dauphin,1,Le koala dort jusqu'à 20 heures par jour car son alimentation à base d'eucalyptus est peu énergétique.,1
106,Anecdotes,Combien de pattes possède un insecte ?,4,6,8,10,2,"Tous les insectes possèdent six pattes, ce qui les distingue des araignées (huit).",1
107,Anecdotes,Quel record détient le guépard ?,Le plus gros félin,L'animal terrestre le plus rapide,Le meilleur nageur,Le plus long saut,2,Le guépard peut atteindre 110 km/h sur de courtes distances.,1
108,Anecdotes,"Quel pourcentage de la surface de la Terre est recouvert d'eau, environ ?",50 %,60 %,71 %,90 %,3,"Les océans, mers et eaux couvrent environ 71 % de la surface du globe.",1
109,Anecdotes,Quel légume est en réalité un fruit d'un point de vue botanique ?,La carotte,La tomate,La pomme de terre,Le poireau,2,"La tomate, contenant des graines et issue de la fleur, est botaniquement un fruit.",1
